{
  "slice_id": "gc2-s0",
  "catalog_id": "construction-catalog/gc2-s0",
  "attempt": {
    "operation": "CONSTRUCT",
    "class_id": "relay",
    "actor_id": "player.nacre",
    "room_id": "room.relay-quarter",
    "actor_room_id": "room.relay-quarter",
    "hidden_room": false,
    "budgets": { "energy": 80, "compute": 64, "storage": 16, "influence": 40, "attention": 8 },
    "live_classes_in_room": ["relay"]
  },
  "expected": {
    "outcome": "REJECT",
    "reason": "SLOT_OCCUPIED"
  }
}
